{
 "meta": {
  "version": 1,
  "updated_at": "2026-10-01T10:00:00Z",
  "jobs": {
   "daily": "2026-10-01T10:00:00Z",
   "weekend": "2026-10-01T10:00:00Z",
   "results": "2026-09-28T10:00:00Z",
   "pros": "2026-09-01T10:00:00Z"
  },
  "ai": true,
  "wt": true,
  "sample": true
 },
 "races": [
  {
   "id": "ironman-northshore-2026",
   "series": "IRONMAN",
   "name": "IRONMAN Northshore",
   "date": "2026-08-16",
   "place": "Northshore, USA",
   "tz": "America/Chicago",
   "official_url": "https://www.ironman.com/",
   "results_url": "https://www.ironman.com/",
   "confirmed": true
  },
  {
   "id": "70-3-harbor-city-2026",
   "series": "70.3",
   "name": "IRONMAN 70.3 Harbor City",
   "date": "2026-09-27",
   "place": "Harbor City, USA",
   "tz": "America/New_York",
   "starts": {
    "women": "2026-09-27T07:00:00-04:00",
    "men": "2026-09-27T07:05:00-04:00"
   },
   "official_url": "https://www.ironman.com/",
   "results_url": "https://www.ironman.com/",
   "confirmed": true
  },
  {
   "id": "t100-northbay-2026",
   "series": "T100",
   "name": "Northbay T100",
   "date": "2026-09-27",
   "place": "Northbay",
   "country": "Sample",
   "tz": "Europe/Madrid",
   "starts": {
    "women": "2026-09-27T13:00:00+02:00",
    "men": "2026-09-27T16:00:00+02:00"
   },
   "distance": "2 km / 80 km / 18 km",
   "official_url": "https://t100triathlon.com/",
   "results_url": "https://t100triathlon.com/",
   "confirmed": true
  },
  {
   "id": "wtcs-lakeport-2026",
   "series": "WTCS",
   "name": "WTCS Lakeport",
   "date": "2026-09-27",
   "place": "Lakeport",
   "country": "Sample",
   "tz": "Europe/Madrid",
   "starts": {
    "women": "2026-09-27T10:00:00+02:00",
    "men": "2026-09-27T13:00:00+02:00"
   },
   "distance": "Olympic distance",
   "format": "draft-legal",
   "headline": "A 12-athlete pack came off the bike together; Ortiz and Chen won the run.",
   "official_url": "https://triathlon.org/",
   "results_url": "https://triathlon.org/",
   "replay": {
    "name": "TriathlonLive",
    "url": "https://www.triathlonlive.tv/"
   },
   "wt_event_id": 900100,
   "confirmed": true
  },
  {
   "id": "70-3-lakeside-2026",
   "series": "70.3",
   "name": "IRONMAN 70.3 Lakeside",
   "date": "2026-10-03",
   "place": "Lakeside, USA",
   "tz": "America/New_York",
   "starts": {
    "women": "2026-10-03T07:00:00-04:00",
    "men": "2026-10-03T07:05:00-04:00"
   },
   "points": "2,500 points",
   "official_url": "https://www.ironman.com/",
   "tracking": {
    "name": "IRONMAN Tracker app",
    "url": "https://www.ironman.com/"
   },
   "watch": {
    "name": "DAZN",
    "url": "https://www.dazn.com/"
   },
   "field_count": 15,
   "pros_to_watch": [
    {
     "pro_id": "anna-keller",
     "sex": "F",
     "reason": "Pro Series #1"
    },
    {
     "pro_id": "maya-brooks",
     "sex": "F",
     "reason": "Pro Series #3"
    },
    {
     "pro_id": "ella-novak",
     "sex": "F",
     "reason": "won here 2025"
    },
    {
     "pro_id": "lucas-moreau",
     "sex": "M",
     "reason": "won last weekend"
    },
    {
     "pro_id": "jonas-berg",
     "sex": "M",
     "reason": "Pro Series #2"
    }
   ],
   "confirmed": true
  },
  {
   "id": "wtcs-harbourview-2026",
   "series": "WTCS",
   "name": "WTCS Harbourview",
   "date": "2026-10-03",
   "place": "Harbourview, AUS",
   "tz": "Australia/Sydney",
   "starts": {
    "women": "2026-10-03T23:30:00+10:00",
    "men": "2026-10-04T02:00:00+10:00"
   },
   "official_url": "https://triathlon.org/",
   "tracking": {
    "name": "World Triathlon live",
    "url": "https://triathlon.org/"
   },
   "watch": {
    "name": "TriathlonLive",
    "url": "https://www.triathlonlive.tv/"
   },
   "field_count": 10,
   "pros_to_watch": [
    {
     "pro_id": "nora-ortiz",
     "sex": "F",
     "reason": "WTCS #1"
    },
    {
     "pro_id": "petra-cole",
     "sex": "F",
     "reason": "WTCS #2"
    }
   ],
   "wt_event_id": 900101,
   "confirmed": true
  },
  {
   "id": "t100-riverbend-2026",
   "series": "T100",
   "name": "Riverbend T100",
   "date": "2026-10-04",
   "place": "Riverbend, ESP",
   "tz": "Europe/Madrid",
   "starts": {
    "women": "2026-10-04T19:00:00+02:00",
    "men": "2026-10-04T21:00:00+02:00"
   },
   "official_url": "https://t100triathlon.com/",
   "tracking": {
    "name": "T100 live",
    "url": "https://t100triathlon.com/"
   },
   "watch": {
    "name": "T100 broadcast",
    "url": "https://t100triathlon.com/"
   },
   "field_count": 10,
   "pros_to_watch": [
    {
     "pro_id": "sofia-lind",
     "sex": "F",
     "reason": "T100 #1"
    },
    {
     "pro_id": "jonas-berg",
     "sex": "M",
     "reason": "T100 #1"
    }
   ],
   "confirmed": true
  }
 ],
 "results": [
  {
   "race_id": "t100-northbay-2026",
   "sex": "F",
   "place": 1,
   "pro_id": "sofia-lind",
   "time": "1:52:30",
   "splits": null,
   "source": "official"
  },
  {
   "race_id": "t100-northbay-2026",
   "sex": "F",
   "place": 2,
   "pro_id": "anna-keller",
   "time": "1:53:02",
   "splits": null,
   "source": "official"
  },
  {
   "race_id": "t100-northbay-2026",
   "sex": "F",
   "place": 3,
   "pro_id": "rina-sato",
   "time": "1:53:44",
   "splits": null,
   "source": "official"
  },
  {
   "race_id": "t100-northbay-2026",
   "sex": "F",
   "place": 4,
   "pro_id": "mila-vos",
   "time": "1:54:20",
   "splits": null,
   "source": "official"
  },
  {
   "race_id": "t100-northbay-2026",
   "sex": "F",
   "place": 5,
   "pro_id": "maya-brooks",
   "time": "1:55:01",
   "splits": null,
   "source": "official"
  },
  {
   "race_id": "t100-northbay-2026",
   "sex": "M",
   "place": 1,
   "pro_id": "jonas-berg",
   "time": "1:41:10",
   "splits": null,
   "source": "official"
  },
  {
   "race_id": "t100-northbay-2026",
   "sex": "M",
   "place": 2,
   "pro_id": "theo-grant",
   "time": "1:41:25",
   "splits": null,
   "source": "official"
  },
  {
   "race_id": "t100-northbay-2026",
   "sex": "M",
   "place": 3,
   "pro_id": "kai-fischer",
   "time": "1:42:01",
   "splits": null,
   "source": "official"
  },
  {
   "race_id": "t100-northbay-2026",
   "sex": "M",
   "place": 4,
   "pro_id": "lucas-moreau",
   "time": "1:42:30",
   "splits": null,
   "source": "official"
  },
  {
   "race_id": "t100-northbay-2026",
   "sex": "M",
   "place": 5,
   "pro_id": "jae-kim",
   "time": "1:43:12",
   "splits": null,
   "source": "official"
  },
  {
   "race_id": "wtcs-lakeport-2026",
   "sex": "F",
   "place": 1,
   "pro_id": "nora-ortiz",
   "time": "1:51:40",
   "splits": {
    "swim": "0:18:52",
    "bike": "0:58:31",
    "run": "0:32:20"
   },
   "source": "official"
  },
  {
   "race_id": "wtcs-lakeport-2026",
   "sex": "F",
   "place": 2,
   "pro_id": "petra-cole",
   "time": "1:51:52",
   "splits": {
    "swim": "0:18:49",
    "bike": "0:58:35",
    "run": "0:32:31"
   },
   "source": "official"
  },
  {
   "race_id": "wtcs-lakeport-2026",
   "sex": "F",
   "place": 3,
   "pro_id": "lea-moser",
   "time": "1:52:10",
   "splits": {
    "swim": "0:18:58",
    "bike": "0:58:29",
    "run": "0:32:41"
   },
   "source": "official"
  },
  {
   "race_id": "wtcs-lakeport-2026",
   "sex": "F",
   "place": 4,
   "pro_id": "ella-novak",
   "time": "1:52:33",
   "splits": {
    "swim": "0:19:05",
    "bike": "0:58:22",
    "run": "0:33:01"
   },
   "source": "official"
  },
  {
   "race_id": "wtcs-lakeport-2026",
   "sex": "F",
   "place": 5,
   "pro_id": "maya-brooks",
   "time": "1:52:51",
   "splits": {
    "swim": "0:19:10",
    "bike": "0:58:30",
    "run": "0:33:08"
   },
   "source": "official"
  },
  {
   "race_id": "wtcs-lakeport-2026",
   "sex": "M",
   "place": 1,
   "pro_id": "leo-chen",
   "time": "1:40:12",
   "splits": {
    "swim": "0:17:40",
    "bike": "0:53:10",
    "run": "0:29:22"
   },
   "source": "official"
  },
  {
   "race_id": "wtcs-lakeport-2026",
   "sex": "M",
   "place": 2,
   "pro_id": "tom-hale",
   "time": "1:40:20",
   "splits": {
    "swim": "0:17:38",
    "bike": "0:53:12",
    "run": "0:29:30"
   },
   "source": "official"
  },
  {
   "race_id": "wtcs-lakeport-2026",
   "sex": "M",
   "place": 3,
   "pro_id": "rui-silva",
   "time": "1:40:41",
   "splits": {
    "swim": "0:17:52",
    "bike": "0:53:01",
    "run": "0:29:48"
   },
   "source": "official"
  },
  {
   "race_id": "wtcs-lakeport-2026",
   "sex": "M",
   "place": 4,
   "pro_id": "jae-kim",
   "time": "1:41:02",
   "splits": {
    "swim": "0:18:01",
    "bike": "0:52:58",
    "run": "0:30:03"
   },
   "source": "official"
  },
  {
   "race_id": "wtcs-lakeport-2026",
   "sex": "M",
   "place": 5,
   "pro_id": "theo-grant",
   "time": "1:41:30",
   "splits": {
    "swim": "0:17:45",
    "bike": "0:53:20",
    "run": "0:30:25"
   },
   "source": "official"
  },
  {
   "race_id": "70-3-harbor-city-2026",
   "sex": "F",
   "place": 1,
   "pro_id": "anna-keller",
   "time": "3:52:10",
   "splits": null,
   "source": "reports",
   "source_urls": [
    "https://www.tri247.com/",
    "https://www.slowtwitch.com/"
   ]
  },
  {
   "race_id": "70-3-harbor-city-2026",
   "sex": "F",
   "place": 2,
   "pro_id": "ella-novak",
   "splits": null,
   "source": "reports",
   "source_urls": [
    "https://www.tri247.com/",
    "https://www.slowtwitch.com/"
   ]
  },
  {
   "race_id": "70-3-harbor-city-2026",
   "sex": "F",
   "place": 3,
   "pro_id": "maya-brooks",
   "time": "3:56:02",
   "splits": null,
   "source": "reports",
   "source_urls": [
    "https://www.tri247.com/",
    "https://www.slowtwitch.com/"
   ]
  },
  {
   "race_id": "70-3-harbor-city-2026",
   "sex": "M",
   "place": 1,
   "pro_id": "lucas-moreau",
   "time": "3:35:15",
   "splits": null,
   "source": "reports",
   "source_urls": [
    "https://www.tri247.com/",
    "https://www.slowtwitch.com/"
   ]
  },
  {
   "race_id": "70-3-harbor-city-2026",
   "sex": "M",
   "place": 2,
   "pro_id": "jonas-berg",
   "time": "3:36:02",
   "splits": null,
   "source": "reports",
   "source_urls": [
    "https://www.tri247.com/",